{
  "schema": "fact-event/v1",
  "eventId": "event-fact-fixture",
  "workspaceRevision": 1,
  "opId": "op-fact-fixture",
  "taskId": "task-fixture",
  "factId": "F-ABCDEFGH",
  "type": "fact_recorded",
  "actor": { "principal": { "personId": "person-fixture" }, "executor": null },
  "source": "local",
  "occurredAt": "2026-08-13T00:00:00.000Z",
  "payload": {
    "statement": "Fact event fixture",
    "evidenceSource": "contract fixture",
    "observedAt": "2026-08-13T00:00:00.000Z",
    "confidence": "high",
    "memoryClass": "semantic",
    "memoryTags": ["pattern"],
    "provenance": [{ "runtime": "human", "sessionId": "session-fixture", "boundAt": "2026-08-13T00:00:00.000Z" }],
    "factsDocumentClaim": {
      "path": "tasks/task-fixture-fixture/facts.md",
      "sha256": "e728f98c69d1fec0e9adb46a1027c1ec34d95d549e40be60aa5c3e60b0835502",
      "size": 234,
      "mediaType": "text/markdown",
      "policyId": "typed-machine-writer/v1"
    }
  }
}
